Sur quel pays appartenant à l’Afrique la dernière reine est-elle Ranavalona III ? Elle régna entre 1883 et 1897, avant que Joseph Gallieni ne devienne gouverneur général pour le compte de la France dans sa politique de colonisation.	Madagascar
Quel anatomiste né en 1847 à Berlin a laissé son nom à des cellules dendritiques du système immunitaire et aux îlots du pancréas ?	Paul Langerhans
Quel adjectif pouvant qualifier une saveur sert également à qualifier les lacs présents sur le canal de Suez ? Ces deux lacs sont traversés par le canal et donc par un nombre important de bateaux.	Lacs Amers
"Quel rappeur étasunien a reçu deux années de suite le Grammy Award du meilleur enregistrement de l'année ? En 2025 pour son titre ""Not like us"" et en 2026 pour le titre ""Luther"" en featuring avec SZA."	Kendrick Lamar
Dans la mythologie grecque, quelle fille de Pandion est associé à sa sœur Procné et s’est métamorphosée en passereau avec sa sœur en plus de laisser son nom à une espèce de rossignol ?	Philomèle
Parfois appelé mirliton, quel est le nom du couvre-chef avec une plume typique de la Garde Républicaine française ? Ce couvre-chef d'origine hongroise a été popularisé par les hussards d'origine hongroise.	Shako
Du fait de leur pratique de la danse appelée samā, quel adjectif qualifie les membres de l’ordre religieux des mevlevi originaires de Turquie et appelés derviches ?	Tourneurs
Sous quel nom de 4 lettres issu de l’anglais désigne-t-on la pratique du pari hippique ?	Turf
De son vrai nom Kamel Kebir, quel streamer et vidéaste français spécialisé dans le contenu sur League of Legends est le cofondateur de la Karmine Corp, organisation e-sport ?	Kamet0
Quel nom du chien compagnon de Margote dans Le Manège Enchanté est également le prénom du Dioscure associé dans la mythologie grecque à Castor ?	Pollux
Quel roi de France qui fut agressé par Jean Châtel en 1594 est à l’origine, en avril 1598 de la signature de l’édit de Nantes ?	Henri IV
Quel nom a été donné au supercontinent unique formé au Carbonifère ? Ce continent formé de la collision du Laurussia et du Protogondwana regroupait la quasi-totalité des terres émergées.	Pangée
Quelle région française est représentée par un drapeau créé par Morvan Marchal nommé Gwenn ha Du ? Ce drapeau porte un nom signifiant noir et blanc dans la langue locale.	Bretagne
Quel nom de famille partagé par les frères chanteurs prénommés Joe, Nick et Kevin est aussi le prénom d’un personnage biblique avalé par une baleine ?	Jonas
Quel poisson appartenant au super-ordre des batoïdes  peut être et représenté par un corps aplati et de grandes nageoires compte des espèces dites pastenague ou manta ?	Raie
Selon une expression française exprimant le fait qu’il nous reste du travail, quel aliment est sur planche ?	Pain
Quel architecte à qui l’on doit l’aménagement de la Grande Motte est le cousin d’un ancien premier ministre ? Ils partagent tous les deux le même nom de famille.	Jean Balladur
Quel nom porte l’arrêt de la Cour de Justice des Communautés européennes datant de 1995 et mettant fin au quota de joueurs étrangers dans les clubs européens ?	Arrêt Bosman
Quel nom de 4 lettres porte l’intelligence artificielle utilisable dans X, développée à l’initiative d’Elon Musk en réponse notamment à ChatGPT ?	Grok
Quel personnage de fiction, héros d’une série créée par Mike Judge est le compagnon de Butt-Head ? Cette série fut originellement créée en 1993 avant de faire plusieurs fois son retour à l'écran.	Beavis
Allant jusqu’à Capoue originellement, jusqu’à quelle ville fut prolongée la Via Appia vers 191 avant notre ère ? Cette ville portuaire des Pouilles de plus de 80 000 habitants de nos jours était déjà à l'époque un important port sur l'Adriatique.	Brindisi
Quel terme désigne la particule constitutive du noyau atomique, que ce soit un proton ou un neutron ?	Nucléon
Culminant à 3660 mètres dans la chaîne de Watkins, quelle île a pour point culminant le Gunnbjørn ? Ce pic constitue un nunatak et tient son nom de Gunnbjörn Ulfsson, le premier homme qui aurait aperçu l'île.	Groenland
"Quel groupe ayant interprété ""Take my breath away"", bande originale du film Top Gun porte le nom d'une capitale européenne ?"	Berlin
"Quel arbre de nom scientifique ""yucca brevifolia"" que l’on trouve surtout dans le désert des Mojaves, a laissé son nom au cinquième album de U2 ? Cet arbre porte dans son nom un personnage biblique ayant montré la Terre promise aux Hébreux."	Joshua Tree / Arbre de Josué
Quel nom de 5 lettres désigne la glace indienne à base de lait parfumé à la pistache, à la mangue et à la cardamome, traditionnellement présentée dans un pot en terre ?	Kulfi
Fiancée à Tragicomix, quelle jeune femme est convoitée par Obélix dans plusieurs albums d’Astérix ?	Falbala
Quelle taille des légumes en rondelles et en biais porte le même nom que le petit instrument servant à émettre un son aigu souvent utilisé par les arbitres de sport ?	Sifflet
Possédant deux écrans, d'où son nom, quelle console portable fut commercialisée par Nintendo à partir de la fin de l'année 2004 ? Elle fut vendue à plus de 150 millions d'exemplaires dans le monde.	Nintendo DS (Dual Screen ou Double Screen)
Quelle émission dont le chef d’orchestre était Bob Quibel fut présentée par Philippe Risoli après Jacques Martin et est associée à la phrase « Ils sont où tes parents ? » ?	L'école des fans
Quelle cité grecque, fondée dans la mythologie par un certain Lacédémon et donc parfois nommée Lacédémone, fut la principale rivale de la cité d'Athènes au cours de la guerre du Péloponnèse ?	Sparte
Par opposition aux cathètes, quel nom désigne, dans un triangle, le côté opposé à l’angle droit ?	Hypoténuse
Dans quel pays le président Abdel Fattah al-Sissi prévoit-il le déplacement de la capitale dans une ville nouvelle construite ex-nihilo et censée remplacer Le Caire ?	Egypte
"Originaire de la cité des Tarterêts à Corbeil-Essonnes, quel groupe composé d’Ademo et N.O.S, Tarik et Nabil Andrieu, a notamment interprété ""Au DD"",  et les albums ""Dans la légende"" et ""Deux frères"" ?"	PNL
"Quel fruit de la famille des rutacées et produit par l'arbre de nom scientifique ""citrus latifolia"" est homonyme d’un outil ?"	Lime
Quelle adaptation japonaise du plat portugais peixinhos da horta est un plat de friture, constituant en des beignets très populaires au Japon ?	Tempura
"À quel célèbre écrivain étranger adepte du roman fantastique ou d’horreur doit-on ""La chaîne du destin"" en 1875, ""Le joyau des sept étoiles"" en 1903 et ""La dame au linceul"" en 1909 ?"	Bram Stoker
Dans quel pays la victoire des athlètes Lee Bhekempilo Eppie, Letsile Tebogo, Bayapo Ndori et Busang Collen Kebinatshipi au relais 4x400m masculin aux championnats du monde d'athlétisme 2025, fut-elle célébrée par un jour férié le 29 septembre, décrété par le président Duma Boko, la veille de la fête nationale du pays ?	Botswana
Animateur du FloodCast avec Adrien Ménielle et ancien membre de Golden Moustache, quel réalisateur français a réalisé Nous, les Leroy en 2024 ? Son nom est homophone d'un écrivain français du XIXe siècle.	FloBer / Florent Bernard
Sous quel pseudonyme s’est fait connaître David Strajmayster, acteur principal de Samantha Oups ? Un nom paronymique est partagé par un lapin de fiction qui dessinait dans un dessin-animé, toujours avec Yoko sa coccinelle.	Doudi ou Didou
Qui était le seul humain de tous les temps non présent dans le champ de la photographie prise le 21 juillet 1969 présentant deux astronautes et la Terre en arrière-plan ?	Michael Collins
Quel élément chimique de numéro atomique 83 est associé au pseudonyme utilisé par Nicolas Sarkozy dans l’affaire des écoutes ? Cet élément, le dernier du groupe des pnictogènes, porte un nom issu de l'arabe.	Bismuth
Quel comté anglais, dont la capitale est Exeter, a laissé son nom à une période géologique précédée par le Silurien et suivie par le Carbonifère ?	Devon
Quel groupe de rock originaire de Glasgow est mené par le chanteur Alex Kapranos depuis 2001 ? Ce chanteur est également le compagnon de la chanteuse française Clara Luciani.	Franz Ferdinand
Tout comme l’axolotl, comment se nomme la capacité qu’ont certains animaux à conserver constamment un état larvaire ?	Néoténie
Appelé collimage au Québec, quel loisir créatif désigné par un nom anglais consiste à personnaliser un album de photos, de souvenirs, un journal intime ?	Scrapbooking
À quel écrivain français doit-on Les Provinciales, quelques années avant Les Pensées ?	Blaise Pascal
Quel français est le sportif le plus médaillé des Jeux Olympiques de Paris 2024 ?	Léon Marchand
Quel type d'être surnaturel est présent sur le logo de l'application Snapchat ?	Fantôme
Quel mot constitue le titre d'une émission présentée par Thierry Beccaro sur France 2 de 1990 à 2019 ?	Motus
Quelle ville, qui fut fondée par la légende selon Sémiramis, est associée à la merveille antique des Jardins Suspendus ?	Babylone
Quel astronome né à Toruń est celui ayant introduit et/ou développé la théorie de l’héliocentrisme, soit de la position centrale du Soleil dans le système solaire ?	Nicolas Copernic
Quelle ville considérée comme le paradis des assureurs est le chef-lieu des Deux-Sèvres ?	Niort
Quelle ville au centre de la chanson « Empire State of Mind » de Jay-Z et Alicia Keys est surnommée « Big Apple » chez les anglophones ?	New-York
Quel oiseau de la famille des apodidés porte un nom rappelant celui d’un fouet ?	Martinet
Présent dans le titre d'un poème de Charles Cros, quel adjectif qualifie le hareng salé puis fumé à froid ?	Hareng saur
"Apparue pour la première fois dans ""L'Affaire Protheroe"", quelle vieille dame anglaise résolvant des enquêtes est l'héroïne de douze romans écrits par Agatha Christie ?"	Miss Marple
Quel pilote automobile fut le fondateur de l’écurie Copersucar, où se trouvait son frère, un brésilien double champion du monde de Formule 1 ?	Wilson Fittipaldi
Quelle marque sud-coréenne détient la chaîne YouTube ayant publié Baby Shark, la vidéo la plus visionnée du site ?	Pinkfong
"Dans quel pays actuel est né le cinéaste Otar Iosseliani, il a été naturalisé français en 1982 avant de réaliser le film ""Adieu, plancher des vaches !"" puis de présider la Femis ?"	Géorgie
"Quelle locution latine ayant constitué la devise de la famille Médicis signifie ""hâte-toi lentement"" ?"	Festina lente
Quel gaz, de formule chimique NH₃, incolore et irritant peut brûler les yeux et les poumons à concentration élevée ?	Ammoniac
Quelle île a pour nom local celui de Boriquén ? Ce nom vient de la langue taïno, qui était une langue arawakienne s'étant éteinte dans la région au XIXe siècle.	Porto Rico
Quel titre du duo entre Janet et Michael Jackson paru en 1995 a fait l’objet du clip le plus cher de l’histoire, plus de 7 millions de dollars ?	Scream
Quel organe situé dans la bouche des mollusques se présente sous une forme de râpe et est désigné par un nom de 6 lettres ?	Radula
Quel nom anglais signifiant trèfle désigne le trèfle irlandais, l’un des symboles du pays ?	Shamrock
Ayant pour morale « Patience et longueur de temps font plus force ni que rage », quelle fable de La Fontaine met en scène un rongeur et le roi des animaux ?	Le Lion et le Rat
Quel tenniswoman française a remporté en 2013 le tournoi de Wimbledon ? Il s'agit de la dernière française ayant gagné un tournoi du Grand Chelem.	Marion Bartoli
Sous quel pseudonyme est connue l’influenceuse Kenza Bechrif, au coeur de nombreuses polémiques dont une d’extorsion de fonds, la valant d’être emprisonnée dans le courant de l’été 2024 ?	Poupette Kenza
"Quel mouvement cinématographique ayant laissé son nom à un film de Richard Linklater en 2026 a pour principaux représentants Jean-Luc Godard, François Truffaut par exemple ? Ce mouvement du cinéma français des années 1950/1960 voit son commencement débattu mais on remonte parfois jusqu'au court-métrage intitulé ""La Pointe courte"" tourné par Agnès Varda en 1954."	Nouvelle vague
Quel directeur de la publication de Charlie Hebdo, assassiné en 2015, avait pour vrai nom Stéphane Charbonnier, véritable identité d'où il a tiré son pseudonyme ?	Charb
Prénommé Heinrich, quel médecin allemand né en 1842 a laissé son nom à un type d’oedème ?	Heinrich Quincke
Quelle place de Venise abrite un grand campanile reconstruit au début du XXe siècle ?	Place Saint-Marc
Quel prénom féminin fêté le 13 décembre est commun à des chansons de Daniel Balavoine et Pascal Obispo ?	Lucie
Quel mot désigne les insectes du genre tipula, n’ayant aucun rapport avec quelque personne de la même famille ?	Cousin
Quel aliment peut être cuisiné miroir, parfait ou mollet ?	Oeuf
À quel peintre né en 1863 à Adalsbruk doit-on Puberté et Mélancolie, exposés au musée national d’Oslo ?	Edvard Munch
Quel jeu, parfois appelé babette ou jeu de poches, est désigné par un nom anglais et consiste à lancer des poches remplies de maïs dans un trou présent sur une planche inclinée ?	Cornhole
"Dans une série de jeux vidéo sortie à partir de 2007 et dont le premier opus est ""L'Étrange Village"" et le dernier, à venir est ""Le Nouveau Monde à Vapeur"", quel est le nom du professeur portant un haut de de forme et aidé par Luke à résoudre des enquêtes ?"	Professeur Layton
"Quel film de 1997 évoque le diamant appelé ""Cœur de l’océan"" ? La présence de ce bijou est un des nombreux ajouts scénaristiques dans ce film inspiré d'un drame réel."	Titanic
Quelle association de protection des animaux fut fondée à Vancouver en 1977 par Paul Watson à la suite de son départ de Greenpeace ?	Sea Shepherd Conservation Society
Quel mot masculin désigne le symbole permettant de marquer une racine carrée ? C'est également un terme employé en linguistique.	Radical
Quels sont les DEUX pays asiatiques toujours actuellement séparés par le 38e parallèle nord ? Cette séparation a été le résultat d’une guerre importante de la Guerre Froide. La réponse attend DEUX PAYS	Corée du Nord et Corée du Sud
Quelle résine solide obtenue après distillation de la térébenthine est utilisée sur les crins de l’archet des violons ? Le nom provient d'une cité grecque d'Ionie qui était réputée pour produire cette substance.	Colophane
De quel arbuste de la famille des bixacées extrait-on une poudre orangée donnant notamment sa couleur à la mimolette ?	Roucou
"Quel jeu de société de stratégie créé par le français Albert Lamorisse en 1957 fut originellement créé sous le nom ""La Conquête du Monde ?"""	Risk
Dans quelle œuvre, parfois considérée comme étant le tout premier roman, et parue en 1605, apparaissent les personnages de Chevillard, Dulcinée et Sancho Panza ?	Don Quichotte
Sur quel hippodrome français situé dans l'Oise se court le fameux Prix de Diane ? Cette course, l'une des plus presitigieuses du circuit fut créée en 1843.	Hippodrome de Chantilly
Quelle console sortie le 3 mars 2017 est commercialisée par Nintendo ? Elle fait suite à la Wii U dans la liste des consoles Nintendo et une version 2 est sortie en 2025.	Nintendo Switch
Quel animateur de l’émission Le fou du roi, est également l’animateur du concert du 14 juillet et de Secrets d’Histoire ?	Stéphane Bern
Dans quel pays l'empereur Mutsuhito, empereur entre 1867 et 1912, est-il désormais connu sous le nom de Meiji ? Pendant son règne, le pays a connu un grand essor culturel et industriel.	Japon
Quelle hormone souvent produite en cas de stress est produite par les glandes surrénales et le système nerveux central ? Elle est également appelée épinéphrine.	Adrénaline
Quelle région d'Italie, la plus peuplée avec plus de 10 millions d'habitants, soit un sixième du pays, a pour capitale la ville de Milan ?	Lombardie
Quel genre musical ayant laissé son nom à une chanson d’Ottawan est mis à l’honneur dans le film de John Badham, La Fièvre du samedi soir ?	Disco
Quelle espèce de mysticètes a laissé son nom aux branches en métal composant l’armature d’un parapluie ?	Baleine
Quel ouvrier travaillant la soie à Lyon est associée à la cervelle dans une spécialité fromagère locale ?	Canut
Ayant laissé son nom au syndrome dont souffrait notamment John Merrick, quel dieu grec avait la possibilité de changer de forme à volonté ?	Protée
Qui a remporté une médaille d'or olympique une heure avant la victoire de son épouse Dana Zátopková au lancer du javelot ? C'est l'une des trois médailles olympiques remportées par ce célèbre athlète cette année-là.	Emil Zátopek
Quel nom désignant un rassemblement de scouts à l’échelle d’un pays ou du monde est également le nom de l'opus de Super Mario Party paru en octobre 2024 sur Nintendo Switch ?	Jamboree
Quel test tenant son nom d'une autrice de BD étasunienne prénommée Alison permet de vérifier si une œuvre de fiction met en scène au moins deux femmes discutant de quelque chose d’autre qu’un homme ?	Test de Bechdel
Nommée en l’honneur du père de l’alphabet coréen, roi surnommé Le Grand, quelle ville nouvelle de Corée du Sud est prévue pour remplacer Séoul en tant que capitale	Sejong
Quel mathématicien né dans l'Empire timouride vers 1380 a laissé son nom au théorème également connu sous le nom de loi des cosinus, couramment utilisé en trigonométrie et généralisant le théorème de Pythagore ?	Al-Kashi
Quel massif montagneux européen culminant à 1493 mètres au Feldberg a laissé son nom à une pâtisserie ?	Forêt-Noire
Quel nom porté par la base aéronavale de Lorient l’est aussi par un célèbre bagad breton ? Ce bagad est cité également dans le titre d'une chanson d'Alain Souchon.	Lann Bihoué
Combien de pattes possèdent les scorpions ? Ils appartiennent à la même classe d'animaux que les faucheux.	8
Quelles sont les deux noms représentés par les lettres LU dans le nom d'une biscuiterie fondée à Nantes en 1846 ?	Lefèvre-Utile
"Quel peintre espagnol est l'auteur des tableaux ""Saturne dévorant un de ses fils"", ou encore des célèbres ""Dos de Mayo"" et ""Tres de Mayo"" représentant des soldats français fusillant des espagnols au cours des guerres napoléoniennes ?"	Francisco de Goya
De quelle ville, capitale de l'Ecosse, s'élancera le Tour de France en 2027 ?	Edimbourg
De quelle entreprise Jeff Bezos est-il le fondateur en 1994 ? Le logo de cette entreprise indique en partie une flèche allant du A jusqu'au Z pour signifier l'ampleur du catalogue proposé.	Amazon
Quelle série télévisée dans laquelle Bella Ramsey incarne Ellie et Pedro Pascal incarne Joel Miller est adaptée d’un jeu vidéo de type survival horror ?	The Last of Us
Qui a succédé en 2013 à Hu Jintao en tant que Président de la République Populaire de Chine ? Il est toujours en poste depuis.	Xi Jinping
Quelle soeur jumelle d'Apollon dans la mythologie grecque a laissé son nom au programme visant à renvoyer des humains sur la Lune d'ici quelques années ? Le nom anglais d'Apollon est Apollo, le nom du programme actuel est donc directement lié au premier.	Artémis
Quel est le nom de la rivière coulant sous le pont du Gard ?	Gardon ou Gard
"Quel oiseau de la famille des alcidés est associé, dans une chanson ayant représenté le Luxembourg lors du Concours Eurovision de la chanson de l’année 1980, au terme ""papa"" ?"	Pingouin
Quel est l'unique autre représentant de la famille zoologique à laquelle appartient l'okapi ? L'okapi est endémique des forêts de la République Démocratique du Congo ne fut découvert scientifiquement qu'en 1901 par Henry Johnston.	Girafe
Quelle marque dont les mannequins sont appelés Anges porte le même prénom qu'une ex-Spice Girl ?	Victoria's Secret
"Dans le manga écrit par Haruichi Furudate intitulé ""Haikyū!!"", quel sport est au centre de l'intrigue ?"	Volley-ball
Quelle sportive française, championne du monde de la course en ligne cycliste en 2014, championne olympique de VTT en 2024, a remporté le Tour de France féminin en 2025 ?	Pauline Ferrand-Prévôt
Développé dans le jeu vidéo Gradius, quelle société japonaise de développement et d'édition de jeux vidéo a laissé son nom au tout premier code de triche de l'Histoire, réutilisé à de nombreuses reprises dans d'autres jeux ?	Konami
Quel acteur français s'est éteint dans le domaine de La Brûlerie, situé dans le Loiret, dans la ville de Douchy Montcorbon, où l'acteur a passé la fin de sa vie ?	Alain Delon
Sous quel nom de famille commun sont connus les frères hors-la-loi ayant sévi dans l'Ouest étasunien de 1890 à 1892 et impliqués dans un braquage à Coffeyville notamment ? Ces frères étaient connus sous les prénoms de Bob, Grat, Bill et Emmett et ils ont inspiré de célèbres gangsters de fiction.	Dalton
De quelle espèce animale la britannique Jane Goodall était-elle spécialiste ? Cette éthologue décédée en 2025 s'était installée en Tanzanie en 1960 pour mieux étudier cet animal dans son habitat naturel.	Chimpanzés
S'étant également appelée place Louis XV, place de la Révolution et place Louis XVI, quel est le nom actuel de la place de Paris qui constitue, avec 7,56 hectares, la plus grande place de la capitale française ? Elle est située dans le 8e arrondissement au bout de l'avenue la plus célèbre du monde.	Place de la Concorde
Quelle chanson de merengue, dont le titre fut repris par le rappeur Soolking en 2022, est le plus grand succès du chanteur portoricain Elvis Crespo en 1998 ?	Suavemente
Quelle couleur est associée au thon dans l'autre nom du poisson appelé albacore ?	Jaune
Quelle marque, mise en avant dans le film Le Fondateur en 2014, fut rachetée par Ray Kroc en 1961 à deux frères prénommés Richard et Maurice, fit de lui un milliardaire ?	McDonald's
"Quel pianiste chinois né en 1982 et parfois surnommé ""La rockstar du classique"" porte un nom rappelant deux fois l’organe charnu  placé dans la bouche ?"	Lang Lang
Quel nom utilise-t-on au bowling lorsque l’on fait tomber les dix quilles en deux lancers ?	Spare
Quelle pâtisserie donne son nom à un petit fichier déposé sur le disque dur à l'insu de l'internaute, lors de la consultation de certains sites web, et qui conserve des informations en vue d'une connexion ultérieure ?	Cookie
"À quel réalisateur japonais doit-on les films ""Rashōmon"" en 1950 et ""Les Sept Samouraïs"" en 1954 ? Né en 1910 et décédé en 1998, il est considéré comme le cinéaste japonais le plus influent du XXe siècle."	Akira Kurosawa
Quel président des Etats-Unis a présenté, en janvier 1918, son programme des Quatorze Points, présentant ses solutions pour à la fois mettre fin à la Première Guerre mondiale et reconstruire l'Europe ? Les initiales de son prénom et de son nom sont identiques.	Woodrow Wilson
"Quel adjectif qualifie la maladie auto-immune, caractérisée par une atrophie villositaire également appelée entéropathie au gluten ? Ce terme est dérivé du mot grec désignant le ventre ou les viscères. On l'appelle ""maladie _______"""	Cœliaque
Quelle ville française abrite la Place de Jaude ? Cette place majeure de la ville abrite une statue de Vercingétorix réalisée par Auguste Bartholdi. Cette ville est la préfecture d'un département de la région abrégée en AURA.	Clermont-Ferrand
"À quel groupe de musique italien doit-on notamment les titres ""I wanna be your slave"", ""Baby Said"", et ""The Loneliest"", après leur victoire à l’Eurovision 2021 ? Leur nom signifie ""Clair de Lune"" en danois."	Måneskin
Avec quelle plante, parfois appelée Herbe du Saint-Esprit, des religieuses originaires de la ville de Niort ont-elle réalisé une confiserie typique de la ville ? La plante et la confiserie partagent d’ailleurs le même nom, elle-même homonyme d'un prénom féminin.	Angélique
Dans l’acronyme EHPAD désignant un type d'établissement d'hébergement, quel mot est représenté par la lettre D ?	Dépendantes
Racontant l’histoire de filles ayant été adoptées par un riche propriétaire, quelle série de romans due à l’Irlandaise Lucinda Riley entre 2014 et 2023 est l’une des plus vendues au monde ces dernières années ?	Les Sept Soeurs / The Seven Sisters
Quel sport, dans lequel Thierry Lincou fut le premier joueur hors du Commonwealth à devenir numéro un mondial, voit deux égyptiens actuellement champions du monde Mostafa Asal pour les hommes et Nour El Sherbini pour les femmes ?	Squash
Quel Pokemon représenté par un maillage polygonal dit low-poly évolue en des versions dites 2 et Z ? Il est parfois décrit comme le premier Pokemon créé artificiellement, et est de type Normal, apparaissant dans la première génération de Pokemon.  Il est à l'origine de nombreuses crises d'épilepsie au Japon lors d'un épisode de la série animée.	Porygon
"Quelle actrice, apparaissant dans le clip Paradis d’Orelsan, est une franco-iranienne et la personnalité francophone la plus suivie sur Instagram ? Engagée contre les positions du gouvernement de son pays d'origine, elle a notamment joué dans la série ""Invasion"" sur Apple TV."	Golshifteh Farahani
